{
  "$schema": "../schemas/release-report.v1.schema.json",
  "schema": "eacl-demo.release-report.v1",
  "contractVersion": "explorer.v1",
  "reportId": "sha256:d2623eb413e1c75ac8561e12e2a85bdbee34575fe99fad5ea989a7b34512a5ca",
  "reportState": "pre-release",
  "release": null,
  "source": {
    "demo": {
      "repository": "https://github.com/theronic/eacl-demo.git",
      "sha": null,
      "status": "uncommitted",
      "reason": "The report inputs are not bound to a clean immutable demo commit."
    },
    "eacl": {
      "repository": "https://github.com/theronic/eacl.git",
      "sha": "11114f59fa57fe87c5b7ab412b3123a9c8a1a862",
      "status": "locked",
      "reason": null,
      "lock": {
        "path": "dependencies/eacl-core.lock.json",
        "sha256": "ff7cbf4e06e353415ca6f576da20b0c9c09bb7b2c3a0496b0003028c6bfab6a7"
      }
    }
  },
  "benchmarkEvidence": [],
  "storageDefaults": [
    {
      "outcome": "none",
      "profileId": null,
      "storage": null,
      "claim": null,
      "evidenceId": null,
      "measuredAt": null,
      "reason": "No qualified storage choice is enabled.",
      "backend": "datahike"
    },
    {
      "outcome": "none",
      "profileId": null,
      "storage": null,
      "claim": null,
      "evidenceId": null,
      "measuredAt": null,
      "reason": "No qualified storage choice is enabled.",
      "backend": "datomic"
    },
    {
      "outcome": "none",
      "profileId": null,
      "storage": null,
      "claim": null,
      "evidenceId": null,
      "measuredAt": null,
      "reason": "No qualified storage choice is enabled.",
      "backend": "datalevin"
    },
    {
      "outcome": "none",
      "profileId": null,
      "storage": null,
      "claim": null,
      "evidenceId": null,
      "measuredAt": null,
      "reason": "No qualified storage choice is enabled.",
      "backend": "jank"
    },
    {
      "outcome": "none",
      "profileId": null,
      "storage": null,
      "claim": null,
      "evidenceId": null,
      "measuredAt": null,
      "reason": "No qualified storage choice is enabled.",
      "backend": "datascript"
    }
  ],
  "fixtures": [
    {
      "fixtureId": "eacl-demo-fixture-v1",
      "logicalResources": 10000,
      "manifestSha256": "sha256:b537a6755026fbbc36f68289dc0f35d09a7cd965397d67d9380a6f820963294a",
      "fixtureSha256": "sha256:ec47ae57973bc7e9c580709410e530a7ac64acd24c01f9e3161489e8ebd58dfd",
      "semanticRecordsSha256": "sha256:3bf7618d9276f6597e529cb064a46f95c97b2db7a4918b4dfde36c318aebd9cb",
      "path": "fixtures/manifests/fixture-10000.v1.json"
    },
    {
      "fixtureId": "eacl-demo-fixture-v1",
      "logicalResources": 1000000,
      "manifestSha256": "sha256:718ab977cb401db80329e560723e181578469d6ae360641ef3ea620ab370cfb0",
      "fixtureSha256": "sha256:102bb7c51779bb66ab343dabff42019af95f99bded708e214b13fd56ab3bf33c",
      "semanticRecordsSha256": "sha256:60d1e2aa531bd20025b2a5fe068657a1b1366c60b265f4ca0cf5bebddf5a3dad",
      "path": "fixtures/manifests/fixture-1000000.v1.json"
    }
  ],
  "profiles": [
    {
      "id": "datahike-s3",
      "backend": "datahike",
      "storage": "s3",
      "route": "/",
      "availabilityState": "qualifying",
      "availabilityReason": "The adopted store and replacement reader are locally qualified, but the live Lambda route, immutable deployment identity, memory, and staged smoke remain unqualified.",
      "buildUnits": [
        "datahike-s3"
      ],
      "deploymentEligible": false,
      "deployment": null,
      "lastOutcome": {
        "outcome": "never-deployed",
        "attemptedDemoSha": null,
        "attemptedEaclSha": null,
        "artifactSha256": null,
        "at": null,
        "message": "No consolidated candidate has been deployed."
      },
      "fixture": {
        "fixtureId": "eacl-demo-fixture-v1",
        "logicalResources": 1000000,
        "manifestSha256": "sha256:718ab977cb401db80329e560723e181578469d6ae360641ef3ea620ab370cfb0"
      },
      "runtime": {
        "name": "java25",
        "architecture": "arm64",
        "snapStart": "enabled"
      },
      "memory": {
        "status": "candidate-unqualified",
        "configuredMiB": 1024,
        "qualifiedMiB": null,
        "evidenceId": null,
        "definition": {
          "path": "infra/profiles/datahike-s3-runtime.yaml",
          "sha256": "f1745cb039313a7b7d0e88d4c2509a84a30bd9606c4b756560ea047f4e22620c"
        }
      },
      "alarms": {
        "status": "defined-not-deployed",
        "count": 7,
        "definition": {
          "path": "infra/observability/profile-runtime.yaml",
          "sha256": "f24ea32d3a12e1a3b7619e43936b7c577ceb1e308e79147c2e9295c9956e9ce2"
        },
        "evidenceId": null,
        "reason": "The alarm template exists locally, but no profile-scoped live readiness evidence is published."
      },
      "rollback": {
        "status": "unavailable",
        "kind": null,
        "alias": null,
        "statusObject": null,
        "static": null,
        "reason": "No successful consolidated publication has produced immutable rollback coordinates."
      }
    },
    {
      "id": "datahike-dynamodb",
      "backend": "datahike",
      "storage": "dynamodb",
      "route": "/",
      "availabilityState": "unavailable",
      "availabilityReason": "The repaired adapter passes local qualification, but disposable real-AWS evidence, the protected production table, live cost controls, the one-million-resource seed, memory, and staged smoke remain open.",
      "buildUnits": [
        "datahike-dynamodb"
      ],
      "deploymentEligible": false,
      "deployment": null,
      "lastOutcome": {
        "outcome": "never-deployed",
        "attemptedDemoSha": null,
        "attemptedEaclSha": null,
        "artifactSha256": null,
        "at": null,
        "message": "No consolidated candidate has been deployed."
      },
      "fixture": {
        "fixtureId": "eacl-demo-fixture-v1",
        "logicalResources": 1000000,
        "manifestSha256": "sha256:718ab977cb401db80329e560723e181578469d6ae360641ef3ea620ab370cfb0"
      },
      "runtime": {
        "name": "java25",
        "architecture": "arm64",
        "snapStart": "enabled"
      },
      "memory": {
        "status": "candidate-unqualified",
        "configuredMiB": 1024,
        "qualifiedMiB": null,
        "evidenceId": null,
        "definition": {
          "path": "infra/profiles/datahike-dynamodb-runtime.yaml",
          "sha256": "deb5970382aac1eba11e1c1989ba774c973539c03c61ce2db0a305c64dbe2029"
        }
      },
      "alarms": {
        "status": "defined-not-deployed",
        "count": 7,
        "definition": {
          "path": "infra/observability/profile-runtime.yaml",
          "sha256": "f24ea32d3a12e1a3b7619e43936b7c577ceb1e308e79147c2e9295c9956e9ce2"
        },
        "evidenceId": null,
        "reason": "The alarm template exists locally, but no profile-scoped live readiness evidence is published."
      },
      "rollback": {
        "status": "unavailable",
        "kind": null,
        "alias": null,
        "statusObject": null,
        "static": null,
        "reason": "No successful consolidated publication has produced immutable rollback coordinates."
      }
    },
    {
      "id": "datomic-dynamodb",
      "backend": "datomic",
      "storage": "dynamodb",
      "route": "/",
      "availabilityState": "disabled",
      "availabilityReason": "The history-preserving DynamoDB database and fixed-current read-only Lambda have not been provisioned and qualified.",
      "buildUnits": [
        "datomic-dynamodb"
      ],
      "deploymentEligible": false,
      "deployment": null,
      "lastOutcome": {
        "outcome": "never-deployed",
        "attemptedDemoSha": null,
        "attemptedEaclSha": null,
        "artifactSha256": null,
        "at": null,
        "message": "No consolidated candidate has been deployed."
      },
      "fixture": {
        "fixtureId": "eacl-demo-fixture-v1",
        "logicalResources": 1000000,
        "manifestSha256": "sha256:718ab977cb401db80329e560723e181578469d6ae360641ef3ea620ab370cfb0"
      },
      "runtime": {
        "name": "java25",
        "architecture": "x86_64",
        "snapStart": "disabled"
      },
      "memory": {
        "status": "candidate-unqualified",
        "configuredMiB": 1024,
        "qualifiedMiB": null,
        "evidenceId": null,
        "definition": {
          "path": "infra/profiles/datomic-dynamodb-runtime.yaml",
          "sha256": "d4fc6592d6fc6085948b428a87ea38ae0aab2c511577929c00f76510be78b7a5"
        }
      },
      "alarms": {
        "status": "defined-not-deployed",
        "count": 7,
        "definition": {
          "path": "infra/observability/profile-runtime.yaml",
          "sha256": "f24ea32d3a12e1a3b7619e43936b7c577ceb1e308e79147c2e9295c9956e9ce2"
        },
        "evidenceId": null,
        "reason": "The alarm template exists locally, but no profile-scoped live readiness evidence is published."
      },
      "rollback": {
        "status": "unavailable",
        "kind": null,
        "alias": null,
        "statusObject": null,
        "static": null,
        "reason": "No successful consolidated publication has produced immutable rollback coordinates."
      }
    },
    {
      "id": "datalevin-memory",
      "backend": "datalevin",
      "storage": "memory",
      "route": "/",
      "availabilityState": "unavailable",
      "availabilityReason": "A reproducible AL2023 arm64 native candidate now passes ABI and true in-memory smoke locally, but the maintained fork/native/EACL releases, clean remote-consumer install, Lambda service, and SnapStart lifecycle qualification remain incomplete.",
      "buildUnits": [
        "datalevin-memory"
      ],
      "deploymentEligible": false,
      "deployment": null,
      "lastOutcome": {
        "outcome": "never-deployed",
        "attemptedDemoSha": null,